rank,cluster_id,cluster_score,cluster_title,articles_count,unique_urls,outlets,products,primary_tags,representative_url
1,C051,13.35,Automotriz y Manufactura lideran nuevas oportunidades de empleo en Chile según estudio de ManpowerGroup,24,11,Elamaule; Elconcecuente; Elmagallanews; Elmartutino; Elmorrocotudo; Elnaveghable; Elnortero; Elobservatodo; Elquehaydecierto; Elrancahuaso; Elrepuertero,biz; nacional; regiones,sector:laboral_gobernanza; product:regiones; sector:tecnologia_telecom; sector:economia_macro; region:Valparaíso; region:Metropolitana; region:Maule; source:normal_scrape; economia_negocios,https://www.elnaveghable.cl/noticia/economia/automotriz-y-manufactura-lideran-nuevas-oportunidades-de-empleo-en-chile-segun-estu
2,C040,13.15,Los Ríos contará con el primer robot quirúrgico del sistema público instalado en regiones - Diario de Valdivia,12,6,Diariocorral; Diariodepanguipulli; Diariodevaldivia - Chile Argentina; Diariofutrono; Diariolagoranco; Diariolaguino,nacional; regiones,sector:salud_educacion_social; product:regiones; source:normal_scrape; sector:economia_macro; region:Los Ríos; region:Metropolitana; sector:tecnologia_telecom; sector:ma_distress; salud,https://www.diariodevaldivia.cl/noticia/salud/2026/06/los-rios-contara-con-el-primer-robot-quirurgico-del-sistema-publico-instalado-en-regiones
3,C048,13.15,Los Ríos contará con el primer robot quirúrgico del sistema público instalado en regiones - Diario Lanco,6,5,Diariolanco; Diariolaunion; Diariomafil; Diariopaillaco; Diarioriobueno,nacional; regiones,sector:salud_educacion_social; product:regiones; source:normal_scrape; region:Los Ríos; sector:economia_macro; region:Metropolitana; sector:tecnologia_telecom; sector:ma_distress; salud,https://www.diariolanco.cl/noticia/salud/2026/06/los-rios-contara-con-el-primer-robot-quirurgico-del-sistema-publico-instalado-en-regiones
4,C052,12.85,Regiones Más Fuertes: autoridades regionales presentarán agenda de autonomía al Presidente Kast,22,11,Elamaule; Elconcecuente; Elmagallanews; Elmartutino; Elnaveghable; Elnortero; Elobservatodo; Elquehaydecierto; Elrancahuaso; Elrepuertero; Elvacanudo,nacional; regiones,sector:politica_estado; source:normal_scrape; product:regiones; product:nacional; sector:justicia_seguridad; sector:economia_macro; sector:infraestructura_concesiones; sector:mineria_energia; politica_gobierno,https://www.elnaveghable.cl/noticia/politica/regiones-mas-fuertes-autoridades-regionales-presentaran-agenda-de-autonomia-al-pres
5,C053,12.85,Sernac cuestiona el concepto “gallinas felices” y llama a preferir huevos con certificación real,22,11,Elamaule; Elconcecuente; Elmagallanews; Elmartutino; Elnaveghable; Elnortero; Elobservatodo; Elquehaydecierto; Elrancahuaso; Elrepuertero; Elvacanudo,biz; nacional,economia_negocios; product:regiones; region:Valparaíso; region:Atacama; region:Maule; noise:opinion; sector:economia_macro; source:normal_scrape; sector:politica_estado,https://www.elnaveghable.cl/noticia/economia/sernac-cuestiona-el-concepto-gallinas-felices-y-llama-preferir-huevos-con-certifica
6,C056,12.85,Ley Uber vuelve a complicarse: expertos analizan las alternativas para destrabar su implementación,22,11,Elamaule; Elconcecuente; Elmagallanews; Elmartutino; Elmorrocotudo; Elnaveghable; Elnortero; Elobservatodo; Elquehaydecierto; Elrancahuaso; Elrepuertero,biz; nacional,sector:justicia_seguridad; product:regiones; sector:tecnologia_telecom; source:normal_scrape; sector:politica_estado; sector:infraestructura_concesiones; region:Valparaíso; product:nacional; economia_negocios,https://www.elnaveghable.cl/noticia/economia/ley-uber-vuelve-complicarse-expertos-analizan-las-alternativas-para-destrabar-su-im
7,C054,12.35,Influenza A desplaza al Rinovirus y crecen las consultas respiratorias en la red asistencial chilena,11,11,Elamaule; Elconcecuente; Elmagallanews; Elmartutino; Elmorrocotudo; Elnaveghable; Elnortero; Elobservatodo; Elquehaydecierto; Elrancahuaso; Elrepuertero,nacional,product:regiones; sector:politica_estado; sector:salud_educacion_social; region:Ñuble; source:normal_scrape; region:Los Lagos; region:Valparaíso; sector:empresas_finanzas; salud,https://www.elmorrocotudo.cl/noticia/salud/influenza-desplaza-al-rinovirus-y-crecen-las-consultas-respiratorias-en-la-red-asisten
8,C042,11.85,Aprueban más de $965 millones para fortalecer capacidades de respuesta de Bomberos en Lago Ranco y Paillaco - Diario de Valdivia,6,6,Diariodevaldivia - Chile Argentina; Diariofutrono; Diariolagoranco; Diariolaunion; Diariopaillaco; Diarioriobueno,regiones,sector:ma_distress; product:regiones; source:normal_scrape; sector:salud_educacion_social; region:Los Ríos; sector:politica_estado; sector:justicia_seguridad; region:Los Lagos; noise:deportes,https://www.diariodevaldivia.cl/noticia/actualidad/2026/06/aprueban-mas-de-965-millones-para-fortalecer-capacidades-de-respuesta-de-bomberos-en-lago-ranco-y-paillaco
9,C041,11.7,Los Ríos exhibe su potencial como destino de eventos internacionales en FIEXPO Latin America - Diario de Valdivia,12,6,Diariocorral; Diariodepanguipulli; Diariodevaldivia - Chile Argentina; Diariofutrono; Diariolagoranco; Diariolaguino,biz; regiones,region:Los Ríos; sector:infraestructura_concesiones; source:normal_scrape; product:regiones; sector:salud_educacion_social; noise:deportes; sector:politica_estado; sector:justicia_seguridad,https://www.diariodevaldivia.cl/noticia/turismo/2026/06/los-rios-exhibe-su-potencial-como-destino-de-eventos-internacionales-en-fiexpo-latin-america
10,C047,11.7,Los Ríos exhibe su potencial como destino de eventos internacionales en FIEXPO Latin America - Diario Lanco,6,5,Diariolanco; Diariolaunion; Diariomafil; Diariopaillaco; Diarioriobueno,biz; regiones,region:Los Ríos; sector:infraestructura_concesiones; source:normal_scrape; product:regiones; sector:salud_educacion_social; noise:deportes; sector:politica_estado; sector:justicia_seguridad,https://www.diariolanco.cl/noticia/turismo/2026/06/los-rios-exhibe-su-potencial-como-destino-de-eventos-internacionales-en-fiexpo-latin-america
11,C038,11.45,Confirman avances para renovar rotonda de Yáñez Zavala y Pablo Neruda - Diario de Valdivia,4,4,Diariocorral; Diariodevaldivia - Chile Argentina; Diariomafil; Diariosanjose,regiones,product:regiones; source:normal_scrape; sector:salud_educacion_social; region:Los Ríos; sector:justicia_seguridad; region:Los Lagos; region:Biobío; sector:tecnologia_telecom,https://www.diariodevaldivia.cl/noticia/actualidad/2026/06/confirman-avances-para-renovar-rotonda-de-yanez-zavala-y-pablo-neruda
12,C055,11.25,"Columna:""Modernizar la Alta Dirección Pública también implica hacer atractivo el servicio público""",10,10,Elamaule; Elconcecuente; Elmartutino; Elmorrocotudo; Elnaveghable; Elnortero; Elobservatodo; Elquehaydecierto; Elrancahuaso; Elrepuertero,nacional,product:regiones; sector:politica_estado; source:normal_scrape; sector:empresas_finanzas; sector:justicia_seguridad; sector:salud_educacion_social; sector:economia_macro; product:nacional; educacion,https://www.elmorrocotudo.cl/noticia/educacion/columnamodernizar-la-alta-direccion-publica-tambien-implica-hacer-atractivo-el-ser
13,C004,11.15,"Venezuela confirma muerte del líder del Tren de Aragua y revela que hubo ""enfrentamientos"" durante el operativo",1,1,Emol,nacional,sector:politica_estado; source:normal_scrape; product:nacional; sector:empresas_finanzas; sector:justicia_seguridad; product:regiones; sector:infraestructura_concesiones; sector:economia_macro; internacional,https://www.emol.com/noticias/Internacional/2026/06/13/1202704/venezuela-confirma-muerte-tren-aragua.html
14,C005,11.15,La revancha de la minería: el nuevo ciclo de inversiones por más de US$17.000 millones que toma fuerza en Chile,2,1,Ex-Ante,biz; nacional,sector:mineria_energia; sector:politica_estado; sector:medioambiente_permisos; source:normal_scrape; sector:laboral_gobernanza; sector:economia_macro; sector:empresas_finanzas; sector:justicia_seguridad,https://www.ex-ante.cl/la-revancha-de-la-mineria-el-nuevo-ciclo-de-inversiones-por-mas-de-us17-000-millones-que-toma-fuerza-en-chile
15,C007,11.15,Cuáles son los costos ocultos de la permisología para viviendas sociales que reveló el ministro Poduje,2,1,Ex-Ante,biz; nacional,sector:empresas_finanzas; sector:laboral_gobernanza; source:normal_scrape; sector:politica_estado; sector:infraestructura_concesiones; sector:mineria_energia; product:nacional; sector:tecnologia_telecom,https://www.ex-ante.cl/cuales-son-los-costos-ocultos-de-la-permisologia-para-viviendas-sociales-que-revelo-el-ministro-poduje
16,C006,11.0,La trampa del CAE. Por Kenneth Bunker,1,1,Ex-Ante,nacional,sector:politica_estado; sector:empresas_finanzas; source:normal_scrape; product:nacional; product:regiones; sector:economia_macro; sector:salud_educacion_social; sector:justicia_seguridad,https://www.ex-ante.cl/la-trampa-del-cae-por-kenneth-bunker
17,C001,10.85,Adultos Mayores con demencia y justicia: una brecha que Chile debe cerrar,1,1,Ciper,nacional,product:nacional; noise:opinion; source:normal_scrape; sector:politica_estado; sector:empresas_finanzas; product:regiones; sector:salud_educacion_social; region:Valparaíso,https://www.ciperchile.cl/2026/06/13/adultos-mayores-con-demencia-y-justicia-una-brecha-que-chile-debe-cerrar
18,C002,10.85,Justicia sexual: una tarea urgente en tiempos de retroceso,1,1,Ciper,nacional,product:regiones; sector:economia_macro; sector:empresas_finanzas; noise:opinion; sector:politica_estado; sector:salud_educacion_social; noise:deportes; sector:laboral_gobernanza,https://www.ciperchile.cl/2026/06/13/justicia-sexual-una-tarea-urgente-en-tiempos-de-retroceso
19,C003,10.8,"""Operación conjunta"": Cómo fue y qué se sabe de la acción que dio muerte al líder del Tren de Aragua",1,1,Emol,nacional,sector:politica_estado; sector:empresas_finanzas; product:nacional; sector:laboral_gobernanza; product:df_archive; source:df_body_archive; source:normal_scrape; sector:infraestructura_concesiones; internacional,https://www.emol.com/noticias/Internacional/2026/06/13/1202713/nino-guerrero-tren-aragua-eeuu.html
20,C057,10.7,Irán enfría expectativas y posterga firma de acuerdo con Estados Unidos en medio de tensas negociaciones,2,2,Elnortero; Elvacanudo,regiones,sector:empresas_finanzas; product:regiones; sector:economia_macro; source:normal_scrape; sector:politica_estado; sector:justicia_seguridad; sector:medioambiente_permisos; sector:salud_educacion_social; politica_gobierno,https://www.elvacanudo.cl/noticia/politica/iran-enfria-expectativas-y-posterga-firma-de-acuerdo-con-estados-unidos-en-medio-de
21,C009,10.65,El ocaso de Raúl Torrealba: los años de silencio del exalcalde de Vitacura mientras se acerca el juicio por corrupción,1,1,Ex-Ante,nacional,source:normal_scrape; sector:politica_estado; sector:empresas_finanzas; product:regiones; product:nacional; sector:salud_educacion_social; region:Metropolitana; sector:justicia_seguridad,https://www.ex-ante.cl/el-ocaso-del-raul-torrealba-los-anos-de-silencio-del-exalcalde-de-vitacura-mientras-se-acerca-el-juicio-por-corrupcion
22,C011,10.65,"Quién es Annie Walker, la ejecutiva enviada desde EE.UU. para liderar la potente expansión de Walmart en Chile",1,1,Ex-Ante,biz,sector:empresas_finanzas; sector:politica_estado; sector:laboral_gobernanza; sector:tecnologia_telecom; product:nacional; source:normal_scrape; sector:medioambiente_permisos; sector:infraestructura_concesiones,https://www.ex-ante.cl/quien-es-annie-walker-la-ejecutiva-enviada-desde-ee-uu-para-liderar-la-potente-expansion-de-walmart-en-chile
23,C008,10.35,"Video de la operación: así fue el ataque de EE.UU. que mató al “Niño Guerrero”, máximo líder del Tren de Aragua",1,1,Ex-Ante,nacional,sector:politica_estado; source:normal_scrape; product:nacional; product:regiones; sector:justicia_seguridad; sector:empresas_finanzas; sector:medioambiente_permisos; sector:economia_macro,https://www.ex-ante.cl/video-de-la-operacion-asi-fue-el-ataque-de-ee-uu-que-mato-al-nino-guerrero-maximo-lider-del-tren-de-aragua
24,C010,10.35,"Perfil: 15 cosas que hay que saber del “Niño Guerrero”, el abatido líder del Tren de Aragua (y sus redes en Chile)",1,1,Ex-Ante,nacional,sector:politica_estado; sector:infraestructura_concesiones; product:regiones; product:nacional; region:Metropolitana; source:normal_scrape; sector:justicia_seguridad; region:Atacama,https://www.ex-ante.cl/perfil-15-cosas-que-hay-que-saber-del-nino-guerrero-el-abatido-lider-del-tren-de-aragua-y-sus-redes-en-chile
25,C021,10.35,Instituto Nacional vuelve a suspender clases presenciales tras amenazas de tiroteo: Desbordes acusa que SLEP no ha actuado “con la fuerza que se necesita”,2,1,The Clinic,nacional; regiones,product:regiones; source:normal_scrape; sector:justicia_seguridad; region:Metropolitana; sector:salud_educacion_social; sector:politica_estado; sector:infraestructura_concesiones; sector:empresas_finanzas,https://www.theclinic.cl/2026/06/13/instituto-nacional-vuelve-a-suspender-clases-presenciales-tras-amenazas-de-tiroteo-desbordes-acusa-que-slep-no-ha-actuado-con-la-fuerza-que-se-necesita
26,C023,10.35,"Nuevos enlaces, ciclovías y terceras pistas: los cambios del tramo de la Ruta 5 de Río Bueno-Puerto Montt tras la adjudicación de la concesión por US$ 821 millones",2,1,The Clinic,biz; regiones,sector:infraestructura_concesiones; sector:empresas_finanzas; region:Los Lagos; sector:tecnologia_telecom; sector:politica_estado; source:normal_scrape; sector:salud_educacion_social; sector:economia_macro,https://www.theclinic.cl/2026/06/13/nuevos-enlaces-ciclovias-y-terceras-pistas-los-cambios-del-tramo-de-la-ruta-5-de-rio-bueno-puerto-montt-tras-la-adjudicacion-de-la-concesion-por-us-821-millones
27,C024,10.35,"“Lo más importante es volver el foco a la prevención, más que a la sanción”: Gobierno prepara cambios por vía administrativa a la Ley Karin",2,1,The Clinic,biz; nacional,product:regiones; source:normal_scrape; sector:politica_estado; sector:empresas_finanzas; sector:laboral_gobernanza; sector:infraestructura_concesiones; sector:economia_macro; region:Biobío,https://www.theclinic.cl/2026/06/13/lo-mas-importante-es-volver-el-foco-a-la-prevencion-mas-que-a-la-sancion-gobierno-prepara-cambios-por-via-administrativa-a-la-ley-karin
28,C027,10.35,"Personas en situación de autopista: miles de personas duermen en zonas aledañas a autopistas, un refugio donde el riesgo es morir atropellado | The Clinic",2,1,The Clinic,nacional; regiones,product:regiones; sector:salud_educacion_social; sector:justicia_seguridad; sector:infraestructura_concesiones; source:normal_scrape; product:nacional; sector:politica_estado; region:Metropolitana,https://www.theclinic.cl/2026/06/13/personas-en-situacion-de-autopista-648-personas-duermen-en-dos-autopistas-de-santiago-un-refugio-donde-el-riesgo-es-morir-atropellado
29,C069,10.25,¿Peligraban el Festival del Choclo y otras fiestas? Concejo de Arica aprueba contratación de guardias privados con debate por nueva ley,2,1,Elmorrocotudo,nacional; regiones,product:regiones; region:La Araucanía; region:Atacama; region:Valparaíso; source:normal_scrape; sector:politica_estado; product:biz; sector:empresas_finanzas; cultura,https://www.elmorrocotudo.cl/noticia/cultura/peligraban-el-festival-del-choclo-y-otras-fiestas-concejo-de-arica-aprueba-contratac
30,C020,10.2,“Se ha transformado en un soldado de la batalla ideológica y cultural”: figuras de la oposición le salen al cruce a Quiroz tras sus dichos sobre Boric y el CAE,1,1,The Clinic,nacional,sector:economia_macro; sector:politica_estado; product:nacional; product:regiones; source:normal_scrape; sector:empresas_finanzas; sector:salud_educacion_social; sector:laboral_gobernanza,https://www.theclinic.cl/2026/06/13/se-ha-transformado-en-un-soldado-de-la-batalla-ideologica-y-cultural-figuras-de-la-oposicion-le-salen-al-cruce-a-quiroz-tras-sus-dichos-sobre-boric-y-el-cae
31,C025,10.2,La arremetida de Quiroz contra Boric por el cobro del CAE: “Por algún motivo al expresidente no le gusta que se paguen las deudas”,1,1,The Clinic,nacional,sector:empresas_finanzas; sector:politica_estado; source:normal_scrape; product:nacional; sector:economia_macro; product:regiones; sector:salud_educacion_social; sector:tecnologia_telecom,https://www.theclinic.cl/2026/06/13/la-arremetida-de-quiroz-contra-boric-por-el-cobro-del-cae-por-algun-motivo-al-expresidente-no-le-gusta-que-se-paguen-las-deudas
32,C067,9.9,"Fotos | NASA pone sus ojos en Arica con El Gran Encuentro del Desierto: ""El primer paso es Chile y el siguiente la Luna""",2,1,Elmorrocotudo,biz; regiones,source:normal_scrape; region:Magallanes; product:biz; sector:economia_macro; region:Los Lagos; sector:laboral_gobernanza; region:Valparaíso; sector:politica_estado; tecnologia,https://www.elmorrocotudo.cl/noticia/tecnologia/fotos-nasa-pone-sus-ojos-en-arica-con-el-gran-encuentro-del-desierto-el-primer-pa
33,C070,9.9,$3.900 millones destrabaron una crisis silenciosa en el Hospital de Arica: ¿Qué habría pasado sin estos recursos?,2,1,Elmorrocotudo,nacional; regiones,sector:politica_estado; sector:salud_educacion_social; source:normal_scrape; product:regiones; sector:empresas_finanzas; sector:infraestructura_concesiones; sector:economia_macro; sector:laboral_gobernanza; salud,https://www.elmorrocotudo.cl/noticia/salud/3900-millones-destrabaron-una-crisis-silenciosa-en-el-hospital-de-arica-que-habria-pas
34,C074,9.9,"Lo que Arica necesita: Experta apunta a la atención turística como ""el talón de Aquiles""",2,1,Elmorrocotudo,biz; regiones,region:Valparaíso; region:Atacama; region:Antofagasta; source:normal_scrape; region:Los Lagos; sector:politica_estado; sector:justicia_seguridad; sector:empresas_finanzas; economia_negocios,https://www.elmorrocotudo.cl/noticia/economia/lo-que-arica-necesita-experta-apunta-la-atencion-turistica-como-el-talon-de-aquiles
35,C149,9.9,"Francisco Undurraga: âYo tampoco como ministro hubiese deseado generar ajustes, pero estÃ¡n en una lÃnea coherenteâ",2,1,Diarioconcepcion,nacional; regiones,product:regiones; sector:politica_estado; source:normal_scrape; sector:salud_educacion_social; sector:tecnologia_telecom; sector:empresas_finanzas; sector:justicia_seguridad; sector:economia_macro; cultura,https://www.diarioconcepcion.cl/cultura/2026/06/13/francisco-undurraga-yo-tampoco-como-ministro-hubiese-deseado-generar-ajustes-pero-estan-en-una-linea-coherente.html
36,C178,9.9,Exalcalde Fernando Paredes confía en su absolución tras avance del caso Luminarias LED,2,1,Itvpatagonia,nacional; regiones,source:normal_scrape; product:regiones; sector:justicia_seguridad; sector:infraestructura_concesiones; sector:politica_estado; sector:empresas_finanzas; region:Metropolitana; region:Biobío; regiones,https://www.itvpatagonia.com/noticias/regional/12-06-2026/exalcalde-fernando-paredes-confia-en-su-absolucion-tras-avance-del-caso-luminarias-led
37,C019,9.85,Identificar y eliminar solo células con mutaciones: la innovadora técnica que busca combatir hasta los cánceres más difíciles,1,1,The Clinic,nacional,source:normal_scrape; product:regiones; sector:salud_educacion_social; sector:justicia_seguridad; sector:laboral_gobernanza; region:Valparaíso; sector:tecnologia_telecom; sector:mineria_energia,https://www.theclinic.cl/2026/06/13/identificar-y-eliminar-solo-celulas-con-mutaciones-la-innovadora-tecnica-que-busca-combatir-hasta-los-canceres-mas-dificiles
38,C022,9.85,"Quién es Carolyn Rodrigues-Birkett, la nueva contrincante de Michelle Bachelet en la carrera por la secretaría general de Naciones Unidas",1,1,The Clinic,nacional,noise:deportes; sector:empresas_finanzas; product:regiones; product:biz; sector:economia_macro; sector:ma_distress; source:normal_scrape; sector:politica_estado,https://www.theclinic.cl/2026/06/13/quien-es-carolyn-rodrigues-birkett-la-nueva-contrincante-de-michelle-bachelet-en-la-carrera-por-la-secretaria-general-de-naciones-unidas
39,C026,9.85,"¿Por qué algunos gimnasios se quedaron sin músculo?: el dilema que desató en la industria los cierres de Energy, Pacific y CardioPilates",1,1,The Clinic,biz,sector:empresas_finanzas; source:normal_scrape; sector:politica_estado; sector:justicia_seguridad; sector:salud_educacion_social; sector:laboral_gobernanza; sector:ma_distress; sector:mineria_energia,https://www.theclinic.cl/2026/06/13/por-que-algunos-gimnasios-se-quedaron-sin-musculo-el-dilema-que-desato-en-la-industria-los-cierres-de-energy-pacific-y-cardiopilates
40,C175,9.75,Temporal deja embarcaciones destruidas en Barranco Amarillo y reaviva demanda por una posada de abrigo,1,1,Itvpatagonia,regiones,sector:empresas_finanzas; product:regiones; region:Magallanes; sector:infraestructura_concesiones; sector:justicia_seguridad; sector:tecnologia_telecom; source:normal_scrape; sector:politica_estado; regiones,https://www.itvpatagonia.com/noticias/regional/13-06-2026/temporal-deja-embarcaciones-destruidas-en-barranco-amarillo-y-reaviva-demanda-por-una-posada-de-abrigo
41,C073,9.6,"El nuevo desafío de los hogares chilenos: no es falta de disciplina, es falta de capacidad de ahorro",2,1,Elmorrocotudo,biz; nacional,product:regiones; source:normal_scrape; sector:salud_educacion_social; product:biz; sector:politica_estado; region:Valparaíso; sector:empresas_finanzas; sector:justicia_seguridad; economia_negocios,https://www.elmorrocotudo.cl/noticia/economia/el-nuevo-desafio-de-los-hogares-chilenos-no-es-falta-de-disciplina-es-falta-de-capa
42,C101,9.6,Postulaciones para Kinross: abren vacantes para importantes puestos con postulación 100% online,2,1,Elquehaydecierto,biz; regiones,region:Antofagasta; sector:mineria_energia; sector:laboral_gobernanza; product:regiones; region:Metropolitana; source:normal_scrape; sector:empresas_finanzas; sector:economia_macro; economia_negocios,https://www.elquehaydecierto.cl/noticia/economia/postulaciones-para-kinross-abren-vacantes-para-importantes-puestos-con-postulacion-
43,C050,9.4,Los Ríos contará con el primer robot quirúrgico del sistema público instalado en regiones - Diario San José,1,1,Diariosanjose,regiones,sector:salud_educacion_social; product:regiones; source:normal_scrape; sector:economia_macro; region:Los Ríos; region:Metropolitana; sector:tecnologia_telecom; sector:ma_distress; salud,https://www.diariosanjose.cl/noticia/salud/2026/06/los-rios-contara-con-el-primer-robot-quirurgico-del-sistema-publico-instalado-en-regiones
44,C172,9.4,Hospital Regional de Coyhaique dio a conocer su Cuenta Pública Participativa - Diario Regional Aysén,1,1,Diarioregionalaysen,regiones,source:normal_scrape; sector:justicia_seguridad; sector:salud_educacion_social; product:regiones; region:Biobío; region:Los Ríos; region:Los Lagos; noise:deportes; salud,https://www.diarioregionalaysen.cl/noticia/salud/2026/06/hospital-regional-de-coyhaique-dio-a-conocer-su-cuenta-publica-participativa
45,C173,9.4,Bárbara Hernández recibirá el premio Espíritu Antártico 2026 en Punta Arenas,1,1,Itvpatagonia,regiones,sector:empresas_finanzas; product:regiones; region:Magallanes; sector:laboral_gobernanza; source:normal_scrape; sector:mineria_energia; sector:politica_estado; sector:justicia_seguridad; regiones,https://www.itvpatagonia.com/noticias/regional/13-06-2026/barbara-hernandez-recibira-el-premio-espiritu-antartico-2026-en-punta-arenas
46,C177,9.4,Senda y Carabineros refuerzan estrategia Tolerancia Cero para prevenir accidentes de tránsito en Magallanes,1,1,Itvpatagonia,regiones,product:regiones; sector:justicia_seguridad; source:normal_scrape; region:Magallanes; region:Maule; sector:infraestructura_concesiones; region:Valparaíso; region:Atacama; regiones,https://www.itvpatagonia.com/noticias/regional/13-06-2026/senda-y-carabineros-refuerzan-estrategia-tolerancia-cero-para-prevenir-accidentes-de-transito-en-magallanes
47,C179,9.4,Centro de Rehabilitación Cruz del Sur amplía su gimnasio para fortalecer atención a pacientes,1,1,Itvpatagonia,regiones,region:Magallanes; sector:empresas_finanzas; product:regiones; sector:infraestructura_concesiones; sector:laboral_gobernanza; sector:mineria_energia; sector:medioambiente_permisos; source:normal_scrape; regiones,https://www.itvpatagonia.com/noticias/regional/12-06-2026/centro-de-rehabilitacion-cruz-del-sur-amplia-su-gimnasio-para-fortalecer-atencion-a-pacientes
48,C102,9.25,«No le gusta que se paguen las deudas»: Quiroz criticó a Boric y defendió los embargos por CAE,2,2,Atentos; Miradiols,nacional,sector:politica_estado; product:regiones; sector:empresas_finanzas; sector:economia_macro; source:normal_scrape; product:nacional; sector:salud_educacion_social; sector:laboral_gobernanza; noise:opinion,https://www.miradiols.cl/2026/06/13/no-le-gusta-que-se-paguen-las-deudas-quiroz-critico-a-boric-y-defendio-los-embargos-por-cae
49,C044,9.1,Alerta sanitaria por cuatro casos sospechosos de triquinosis - Diario de Osorno,1,1,Diariodeosorno,regiones,sector:salud_educacion_social; source:normal_scrape; product:regiones; region:Los Lagos; sector:justicia_seguridad; region:Los Ríos; region:Biobío; noise:deportes; salud,https://www.diariodeosorno.cl/noticia/salud/2026/06/alerta-sanitaria-por-cuatro-casos-sospechosos-de-triquinosis
50,C060,9.1,Hombre fue encontrado muerto en una vivienda de Renaico,1,1,Lasnoticiasdemalleco,regiones,source:normal_scrape; sector:justicia_seguridad; product:nacional; region:Maule; region:Biobío; region:La Araucanía; product:biz; region:Valparaíso; seguridad_judicial,https://lasnoticiasdemalleco.cl/policial/hombre-fue-encontrado-muerto-en-una-vivienda-de-renaico
